note; resume; opinions

10;Très bon séjour ; Très bel appartement. Personnel très agréable et respectueux. On se sent vraiment chez soi| Le standing et la qualité des services et des équipements |
10;Agréable, apaisant, sans prise de tête; Tout était parfait Je n'ai sincèrement rien à redire J'y retournerais sans réfléchir pour les prochaines vacances| J'ai TOUT aimé en toute sincérité. Localisation, propreté, accueil, petit dej trop bon , il ya de l'eau chaude et de froide, la climatisation, salon et salle à manger, micro ondes, TOUT TOUT TOUT. J'ai eu du mal à croire au tarif jusqu'à ce j'intègre les lieux, sans concurrence. Je recommande totalement.|
10;Formidable wow; Rien| Acceuil parfait|
8.0;Tres bien; Plus d ustensiles cuisine| Pas mal et un peu lourd.|
10;Beau cadre comfortable à prix intétressant; Quelques indications complémentaires pour localiser le lieu peuvent être nécessaires mais tout est dans l'ordre avec la réactivité des hôtes| Appartement charmant avec toutes les fonctionalités au comfort, excellent rapport qualité/prix, personnel avenant et service de qualité|
9.0;excellent; Le wifi qui se deconnectait très souvent| tout était OK.|
10;Le top des hébergements depuis mes fréquents séjours à Douala ; Propriétaire disponible et très accueillante service parfait |
10; Exceptionnel ; Tout était pas parfait on aurai dit une ile paradisiaque. |
8.0;Tres bien; Le wifi était trop nul voir inexistant| Top les différents petits déjeuners|
9.0;Parfaite; Rien| La totale  De l'accueil à la sortie|
10; Exceptionnel ; RAS| Tout c'est très bien passé durant notre sejour j'étais avec un bébé de 7 mois.  Je remercie les hôtes pour leurs gentillesses elles étaient au petit soins. Jen ai fait des logements au cameroun celui ci rentre dans mon top 3. En plus le prix est tres abordable et une propreté irréprochable.  Ce qui est sur quand je reviendrai sur douala c'est laba que je resterai.  Il ya un peu de tout a proximité pharmacie... magasins de nourriture...marché. On était tellement bien qu'on  ne voulait pas rentré. Merci encore a toute l'équipe.|
9.0; Fabuleux  ; Wifi très faible | Propreté et excellent service surtout disponibilité courtoisie dérivabilité  de la gouvernante MATOUTOU Jy passerai tous mes prochains sejours |
9.0; Fabuleux  ; Top|
9.0; Fabuleux  ; Presque parfait|
8.0; Très bien ; Hummm... je cherche ... je cherche...😅😅 il faut bien dire qqch, alors je dirai,le fait que le chien des voisins du quartier soit venu intimider mon chiot 😅😅 . C'est pas de la faute de l'établissement je sais 😄 mais je devais dire qqch . Bon un peu de sérieux , pensez déjà à recevoir les payement par transfert mobile ,et installer une ligne téléphonique pour joindre les gentilles dames de l'accueil .| Emplacement top  Logement top Équipement top  Personnel Top Top  Service top  Même mon chiot a tellement aimé qu'au départ il voulait pas partir 😅  Nous reviendrons c'est sûre et certain. |
10;❤️❤️❤️; C’est devenu ma résidence lors de mes séjours à Douala. Fan +++ de la team Matoutou |
10;Qualité excellente et constante ; Tout...  Comme d’habitude J’en ai fait ma résidence lors de mes passages à Douala, pour l’accueil, le cadre, la propreté et Matoutou toujours aussi discrètement présente |
9.0; Fabuleux  ; Manque de deo pour les toilettes et ustensiles de cuisine insuffisant pour faire un repas avec des amis.| Accueil 100% Propreté 100% Petit déjeuner très bon et a la hauteur du prix. Satisfaction 90%|
8.0;Un sejour court mais tres agreable. Je m'y suis senti vraiment a mon aise.; Rien a signaler!| L'appart etait nickel, tres propre, bien range. Les equipements etaient de bonne qualite et j'ai beaucoup apprecie le matelas de la chambre a coucher qui etait super confortable. Le petit dejeuner, copieux, etait servi a l'heure indiquee. Je salue la disponibilite et la serviabilite de Matoutou et du gardien de jour et recommande vivement cet appartement.|
10;Magnifique; Euh... Les chambres et les toilettes ne sont pas grand 😅 mais il ya de l'espace ils ont su exploiter pour dire vrai j'ai tout apprécié| Le service ( Matoutou est juste adorable ) était parfait, la propreté rien à dire, j'étais tellement à l'aise et au petit soin elle répond à toutes les questions sans problème, elle est disponible, très douce, gentil. Les photos et la réalité sont 👌|
10;Adresse à enregistrer pour les séjours à Douala; Que je demande mon petit-déjeuner pour 8h00 et qu’à 8h00 on me l’apporte, faut pas exagérer avec la qualité 😉 Juste pour dire qu’il n’y a rien à redire | Tout d’abord ma première impression, car la réalité  était conforme aux photos, ensuite la propreté éclatante des lieux et la décoration, très aérée et reposante. Et Matoutou la concierge qui est exceptionnelle de gentillesse et de disponibilité.|
8.0;Excellent !; Pas de groupe en cas de coupure d'électricité.| Nous avons tout aimé : l'accueil, la décoration de l'appartement, les hôtes (toujours à l'écoute et disponible à tout moment), le petit déjeuner, la sécurité Sinon dans l'ensemble, mon fiancé et moi avons passé un agréable séjour.|
10; Exceptionnel ; La propreté est nickel, et nous avons aimé le calme loin des bruits de voitures.|

8.0;Séjour convivial pour une famille; J'ai aimé la disponibilité de la propriétaire, l'ambiance dans le quartier pour et la proximité avec les services dans le quartier d'Akwa.|
9.0; Fabuleux  ;  c'était excellent très bien décorée|  le décor et l'art qui se trouvait sur place|
10;Excellent séjour, je reviendrai ; J'ai tout aimé... la propreté de l'appartement, extrême amabilité du personnel et surtout d'Edith la propriétaire. Tous les appareils ont fonctionné correctement. |
9.0;Excellent séjour. Très bon rapport qualité/prix. Je recommande vivement !!; L'étroitesse du parking extérieur. Il existe toutefois des solutions de partenariat avec un parking sécurisé pas loin.| L'appartement, l'accueil et la disponibilité de la patronne, le professionnalisme du personnel, le petit déjeuner|
9.0;Très beau séjour dans l'ensemble. Je reviendrais ; Juste le côté un peu bruyant de la zone. Mais il fallait s'y attendre. On est tout de même au centre ville, et à Douala qui plus est. | La convivialité de l'hôtesse et de tout le staff, la qualité des fournitures et du mobilier, la propreté et le confort de l'appartement qui était exactement tel qu'annoncé sur Booking. La sécurité de mon véhicule a bien été assurée.  Merci à Edith et à toute l'équipe.  Nous reviendrons certainement. |
10; Exceptionnel ; Je commande Vivement ,personnel disponible  Service , irréprochable.|
8.0;Séjour agréable et belle expérience en famille dans un quartier populaire très animé de Douala; RAS| L’accueil et la disponibilité de tous. Le service était impeccable et les lieux fidèles aux photos. Air conditionné, équipements nécessaires  et propreté irréprochable.|
10;Un super accueil ; L accueil chaleureux de l'équipe  La réactivité et la disponibilité de l équipe  Immeuble de standing dans un quartier populaire très animé |
9.0;Residence avec du charme, tres bon accueille, top si vous aimes pas les grandes chaines comme moi; Residence avec du charme, si vous aimez l’art africaine contemporaine ou ancienne this is the place to be! Gerant et proprio tres tres accueillants, nous ont aidé enormement avec adresses contactes taxis conseils etc.|
7.9;Accueil et personnel sympa. Note spéciale à Aristide. Très attentif et disponible; Le quartier dénote par rapport établissement| Pas de croissant|
7.9;Bref mais fun; Le bruit des bars alentours la nuit| Le salon spacieux et les toilettes propres et les draps aussi|
9.6; Fabuleux  ; Beau, propre et inspirant.|
10;Accueil chaleureux - on se sent comme chez soi; l'hébergement est central mais la contrepartie ce sont les nuisances sonores la nuit| Le petit déjeuner était très bien organisé et le personnel compétent et agréable.  Très bon contact avec les responsables de cet hébergement qui ont le souci du service|
10;PARFAIT EN TOUT POINT; RIEN| TOUT|
9.2;Séjour reposant, quartier populaire, empreint d'originalité; Il y avait des travaux en cours. Mais ceux ci finiront bientôt si c'est pas déjà le cas| La résidence est placée dans un quartier original de Douala|
8.8;Un lieu idéal pour un séjour court ou professionnel à Douala; L’accueil, la propreté, et la taille de l’appartement|
10;bien , bien , bien............; halte incontournable lors des venues a douala tout est la.......acceuil , propreté , gentilesse et disponibilité du personnel  ne cherchez pas ailleur pour votre sejour.....|
10; Exceptionnel ; accueil et confort toujours de qualité|
9.6; Fabuleux  ; Rien !  | Accueil très chaleureux de Madame Mbella, la propriétaire des lieux . Les appartements sont calmes, confortables et décorés avec bcp de goût . Bcp de statues et d’œuvres d’art dans la résidence! Un régal ! Personnel adorable! On se sent à la maison 😊|
9.6; Fabuleux  ; L’appartement lui même, très cosy et décoré d’œuvres d’art. Le proximité avec la boulangerie super marché AKWA, l’équipement de la cuisine, le confort des lits, la climatisation, la propriétaire, une dame passionnée d’art et passionnante |
10; Exceptionnel ; Il ne faut pas venir à Douala sans aller à Bolo résidence: extraordinaire par la beauté des objets d'art exposés,les petites attentions ,l'accueil de tout le personnel et la décoration florale régulièrement renouvelée.On se croirait  en forêt tropicale tant les plantes et surtout les fleurs coupées sont belles,dans les lieux publics mais aussi les chambres.Je suis arrivé par hasard et je reviendrai par choix,je vous recommande vivement d'essayer. Quant à la propriétaire,c'est une personne très cultivée,très ouverte et qui possède des qualités humaines exceptionnelles.Allez-y sans hésitation,un endroit rare au Cameroun. |
8.3;UN EXCELLENT SEJOUR ! Je confirme les précédents commentaires concernant cette Résidence.; Un point totalement indépendant de la Résidence : la musique et chants nocturnes dans les rues essentiellement sur les W.E.| Le professionnalisme de l'Hôtel et la fiabilité du personnel. Mme Edith Mbella est régulièrement soucieuse du bien être de ses clients et grandes disponibilités de M Emmanuel TCHOUNGA (son adjoint) pour renseigner sur : sites géographiques, appels de taxis climatisés, bons restaurants avec leurs spécialités, commente agréablenent la galerie d'art qui se trouve au R.C., il est  joignable également facilement par téléphone ce qui est un avantage certain dès lors qu'on est en extérieur de la Résidence. La literie est excellente et la propreté de l'appartement est de rigueur ! La femme de ménage effectue un nettoyage à fond journellement avec beaucoup d'attention. Pont d'importance, M Emmanuel TCHOUNGA est venu m'accueillir à mon arrivée à l'aéroport de Douala et m'y a remmener le jour de mon départ et cela gracieusement !|
10;Sejour tres agreable; Tres bonne accueil chaleureuses l 'appartement tres bien aménagé  et propre très  Bien situé dans un quartier animé  le week-end, le personnel tres gentille lieux  tres sécurisé gardiens  toujour disponible et souriant je suis satisfait  de mon séjour  avec ma famille  merci a la patronne  des lieux  pour son accueil  et ca disponibilité|
8.3; Très bien ; Le bruit la nuit et la rue d’accès non entrentenue| L’espace du logement et le personnel toujours prêt à rendre service|

9.0;Bel accueil; La vue| La gentillesse du personnel|
8.0; Très bien ; Chambre confortable  Quartier calme  Personnel attentionné |
8.0;ok , très bon séjour; Le salon de réception et d'attente, un peu réduit,| Petit déjeuner tout à fait correct, globalement bonnes prestations|
9.0; Fabuleux  ; Rien| Le petit-déjeuner et le personnel |
9.0;ALL OK. je reviendrais volontier; la moquette au couloir semble garder bcp de salete. bref une odeur un peu bizard au couloir| Le petit dejeuner est parfait. Rien à dire  La chambres etait propre|
7.0; Bien  ; Le restaurant n'avait rien de ce que j'ai demandé et qui pourtant était sur la carte, ni pour le diner ni pour le petit déjeuner.|
8.0;Enfin un établissement de qualité ; Rien | L ensemble |
9.0;Exceptionnel! Définitivement le meilleur hôtel de Douala!; Tout était à la hauteur de mes attentes 👌🏾| Tout: L’emplacement, la propreté, le service, tout le personnel est d’une très grande gentillesse. C’est sans conteste l’hôtel le plus propre et confortable de la ville. Bravo à toute l’équipe, surtout le housekeeping. Un grand merci à Jules pour son sens du service. 🙏🏾|
8.0;Séjour plus que agréable. Remerciements et encouragements au personnel.; Le bruit des climatiseurs dans les chambres.| L’accueil, la qualité des équipements, le confort du lit et des draps. Les tenues du personnel de salle sont originales, le buffet est fourni et varié|
8.0; Très bien ; Le Guest Relation Manager s'est montré très professionnel pour gérer l'incompréhension qui est naît de l'inadéquation entre la communication du site booking et les offres de l hôtel  à cette période.|
9.0;Apaisant et très satisfaisant; Tout était très bien pour moi.| Diversifié et très bon. Le personnel était vraiment très accueillant, à l’écoute et très chaleureux. La propreté de l’hôtel rien à dire et les équipements (salle de sport et piscine) m’ont ravi|
8.0;Magnifique ; La présence des prostituées à l'extérieur qui surdoient les gardiens pour avoir accès à l'hôtel et être informé sur la présence de certains clients. | Accueille et politesse du personnel, propreté....j'ai adoré mon séjour à ce paradis reposant |
9.0; Fabuleux  ; L'établissement a moins d'un an, mais il y a déjà des dégâts des eaux dans certaines chambres. Nous avons dû demander deux fois à changer de chambre. Heureusement, nos demandes ont toujours été traitées avec la plus grande attention. Aussi, la piscine est vraiment petite, et très peu profonde. Pour l'amateur de natation que je suis, c'est une déception. | Le personnel est très attentionné à La Falaise Bonapriso. On sent que des efforts sont faits pour rendre un service parfait aux clients. Que ce soient les vigiles à l'extérieur, les stewards, les employés du restaurant. Tout le monde a le sens du service. C'est une qualité tellement peu commune au Cameroun qu'elle vaut le coup d'être soulignée ici.|
9.2;Excellent séjour à la falaise Bonapriso; Le bar avec la piscine à proximité, la qualité de la salle d'eau|
7.5; Bien  ; Baignoire,pas de douche,uniquement des baignoires dans toutes les chambres de l’établissement.En cas d’un handicape,il est difficile d’avoir accès. |
7.9; Bien  ; La disponibilité et le professionnalisme du personnel | Outre ce qui précède, l'accueil aussi bien à l'aéroport qu'à la réception de l'hôtel sont des atouts non négligeables.|
8.0;Corrrecte; Le rapport qualité prix. 200 euros est très supérieure à la prestation| Le confort... le petit  déjeuner ....|
9.2;Bien et agréable; Ras| Le lit et les serviettes|
8.8;Excellent séjour dans un bel établissement avec un personnel très professionnel; Petits détails de finition dans la salle de bain| Bel établissement à 10 min de l'aéroport. J'ai particulièrement apprécié le petit déjeuner à emporter proposé par le personnel en raison de mon départ matinal (5h du matin)|
7.5;En gros le personnel sympa, et le lieu bien sécurisé; J’ai surtout pas apprécié le Guest manager qui m’as dit que j’avais pas le droit de recevoir plus de 2 personnes dans l’hôtel sans savoir le but de mon voyage, j’ai trouvé ça très gonflé,| J’ai aimé  l’accueille du personnel et la sécurité bien organisée|
9.6;Parfait; Le professionnalisme des équipes |
8.8;Agréable; J'ai trouvé étrange, l'absence d'un saloon comme dans la plupart des hôtels de ce genre. Il y a bien un bar mais la disposition de ce dernier parraport au restaurant ne donne pas une impression d'intimité au client de se sentir comme chez soi.| J'ai aimé la nourriture, la disponibilité, l'acceuil chaleureux, et le professionnalisme du personnel.|
8.8; Très bien ; Instabilité des chaînes télés. En cas de coupure du courant, il faut un reprise automatique de l'alimentation électrique | L'accueil est excellent. Le petit-déjeuner aussi est excellent.|
8.3; Très bien ; Rien| L’emplacement, l’accueil et les équipements.|

8.0;Très bonne prestations !; Rien en particulier| Tout était bien le personnel les chambres le calme...|
9.0;Hôtel à recommander; Pas de deuxième verre ni chaise dans une chambre réservée pour 2 adultes Salle de fitness avec des appareils non branchés impossibles à régler...| L accueil  La gentillesse du personnel Le professionalisme Les repas de qualité|
8.0; Très bien ; La climatisation au niveau des chambres est difficile à régler (peu d'options et boitier éloigné de la zone de repos).  Le service au niveau de la piscine est lent.| L'hotel est bien placé, prés de l'aéroport, ce qui est pratique pour les départs tot le matin. Le personnel est charmant et a répondu à mes messages avant mon arrivée concernant la navette et le contact au cas ou il y aurait des retards à l'arrivée. Le petit déjeuner buffet est très bien achalandé et le déjeuner buffet est savoureux. La literie est confortable et la connexion Internet est bonne.|
8.0; Très bien ; Le personnel très disponible et serviable|
7.0;Confortable; la connection internet est instable , la qualite devrait etre ameliore| le petit dejeuner etait vraiment super , varie de bonne qualite et avec un personnel disponible .  les mesures barrieres COVID-19 etaient appliquees|
9.0; Fabuleux  ; Le début du ménage à 8h. | La chambre, la salle de sport, le petit déjeuner , le restaurant. |
7.0;bon sejour, jy reviendrai; le repas buffet du soir ...|
8.0;Excellent séjour ; La salle de sport avec matériels défectueux (pas de tapis de course en réparation m’a-t-on dit), vélo bloqué sur une faible vitesse etc...| La gentillesse du personnel, la propreté, l’emplacement, le bar extérieur, le petit déjeuner complet avec beaucoup de fruits frais notamment. Et chambre bien aménagée. |
9.0; Fabuleux  ; Certains réceptionnistes, visages fermés, pas souriants, presque désagréables à la limite.  Service très lent à l’accueil pour l’enregistrement et les départs.  Un remboursement effectué sans explication, et je me retrouve avec moins d’argent que ce qui été mentionné sur ma facture sans explications. | Tout sauf le personnel|
8.0;Hôtel correct pour nous qui étions de passage au Cameroun.; -Petit déjeuner un peu pauvre mais reste correct et en harmonie avec le prix de la chambre  étant donné qu'il était inclus. -Pas assez de serviettes et nous avons demandé mais nous n'avons pas eu de retour - Il manquait un petit frigo dans les chambres| La déco originale. L' accueil de la réceptionniste  La proximité par rapport à l'aéroport  La propreté des lieux|
8.0; Très bien ; Le buffet (sauf le petit déjeuner) n'est pas assez complet. Et l'eau de la douche déborde vite | L'accueil |
7.0;Bien dans l’ensemble; L’espace très réduit dans les chambres| Design|
8.0; Très bien ; Chambre pour deux personnes mais jeu de serviettes pour une seule, idem une seule tasse un seul verre!!!! C est dommage!!| Le buffet La literie,  la navette aéroport La propreté L accueil La réactivité |
9.0;Je recommande ; L’accès au parking est étroit et difficile d’accès pour des suv.... | Le cadre est reposant et à proximité de toutes commodités. Le personnel est agréable et à l’écoute. |
8.0; Très bien ; Rien | Il est neuf|
8.0;Agréable; À 9h le petit déjeuner était presque fini Le WC n'a pas de robinet le papier hygiénique n'étant pas suffisant pour être très à l'aise| La qualité du lit|
8.0; Très bien ; Séjour toujours agréable et personnel à l'écoute des clients.|
8.0; Très bien ; la chambre est petit | le personnel était très accueillant et gentil |
7.0; Bien  ; Les toilettes n'avaient pas été bien nettoyé Ya pas d'essuie pied ou de serpillière le client fini par mouillé le sol de sa chambre.  De plus les toilettes sont petites , l'eau dégouline dans la chambre | Le menu petit déjeuner est varié Les équipements sont adéquats  La sécurité est de rigueur|
7.9; Bien  ; Pas de produits suffisant( shampooing, gel de douche,... ) | Propreté des espaces Personnel avenant Bon emplacement Connexion internet rapide Buffet petit-déjeuner complet |
9.0; Fabuleux  ; Le tapis de la salle de sport n'est toujours pas réparé... Elle fait très vide et c'est dommage car on ne peut pas aller courir dehors vu la proximité avec le port et la pollution... | Le personnel et la propreté impeccable ! |
9.0; Fabuleux  ; Très belle chambre et restaurant bien agencé |
7.0; Bien  ; l'eau qui remonte apres le bain difficile a s'evacué| le buffet|
8.0;c'était cool! je recommande cet hôtel à tous ceux qui sont de passage à douala; qu'il n' y ait pas de sèche-cheveux dans la chambre| le petit déjeuner est varié et j'ai surtout aimé l'emplacement de l'hôtel.|

8.0; Très bien ; L accueil et le service restauration n était pas à  la hauteur de l hôtel, attente d'une heure pour trois commandes, nous étions les seuls, la carte  inutile car peu de disponibilités en produits, et trop d 'indifférence des serveuses je dis bien ...es car les serveurs étaient un peu plus attentifs  quant à notre attente et notre présence, Très décevant pour la qualité de l Hôtel. Concernant la climatisation comme elle n est pas centralisée, le réglage un peu complexe et le bruit dérangeant or elle est obligatoire vu la bonne isolation....il fait tout de meme très chaud a Douala..'et les moustiques ces facteurs empêchent de rester les fenêtres ouvertes et obligent à l'utilisation forcée de la climatisation.| L'emplacement, la propreté et les équipements, le calme, la literie, la décoration.|
8.8; Très bien ; la liiterie un peu dure| le restaurant l acceuil et la gentilesse  du personnel|
9.2;Calme et confortable.; Restauration à améliorer (petit dej) . Matelas du lit un peu dur. Signal du wifi à amplifier dans les chambres. Meilleur indication de la situation géographique de l'hôtel.| Chambre spacieuse et confortable. Rapport qualité/prix. Equipements dignes d'un véritable grand hôtel. Boissons chaudes dans les chambres.|
6.7; Agréable ; Perso j'ai trouvé la brasserie un peu coincée et pas conviviale. | La propriété des chambres |
9.2;Parfait; La connexion internet faible| Le calme et la quiétude de l'environnement. La convivialité du personnel|
8.8;Confortable; Eau douche| La propreté des lieux|
8.5; Très bien ; le  seul point  negatif  et la  distance  a parcourir  avant  de pouvoir  trouver  un  taxi.  un  conseil  la  navette  doit etre disponible  a  tout  moment . on a l impression que  nouis  dérangeons  quand on demande une  navette et  ca  c est  un vrai probleme .les  gens préfèrent payer plus et avoir  la  liberte de  se deplacer.| tout  sauf  l eloignement.|
8.8; Très bien ; Emplacement géographique un peu en retrait | la gentillesse du personnel . La qualité des services . La prestation de la chambre . le repas  et petit déjeuner copieux|
7.1; Bien  ; Internet dans ma chambre au premier étage ne fonctionnait pas. |
9.2; Fabuleux  ; Un peu loin du centre de la ville et loin des moyens de transports | Petit déjeuner, confort et propreté |
6.7;Bon excepté le lit qui ne nous a permis de nous reposer longtemps; Le lit beaucoup trop ferme| Les chambres sont bien aménagées , ainsi que l'hôtel qui est plutôt  agréable|
8.8; Très bien ; Les draps avaient une odeur de moisi | L’accueil du personnel, la propreté de l’hôtel et surtout le Confort des chambres ! |
8.8;Bon hôtel ; Location un peu isolé | Établissement très propre et neuf, digne d’un hôtel 3 étoiles, de loin le meilleur hôtel que j’ai eu séjourner à Douala, personnel très aimable et souriant |
6.7;Bien; La froideur de la réceptionniste le matin.Pas très accueillante| J'ai été satisfait du petit déjeuner,cependant on m'a facturě le petit déjeuner de ma partenaire alors qu'au moment de la réservation, il était bien précisé que le petit déjeuner était offert.J'ai appellé l'hôtel avant mon arrivée pour être sûr qu'il était bien gratuit et on me l'a confirmé.J'ai payé 9500francs cfa de plus(14€61)pour le 2ième petit déjeuner,ce qui est énorme.Le matin en allant payer,quand la réceptionniste m'a annoncé cette facture,je lui ai expliqué en lui montrant la réservation booking prouvant que le petit déjeuner était gratuit,mais elle m'a dit que c'était comme ça.Pourquoi l'hôtel ne me l'a précisé lors de ma réservation?ce n'est pas normal|
9.6; Fabuleux  ; L hôtel est très propre |
8.3;Mon séjour était très agréable. J'ai travaillé la tête libre et l'équipement y était ok. Bravo!!; Cependant, veuillez annoncer les bons prix tant pour les chambres que pour les repas. Mettez à jour la carte et annoncez la taxe de séjour dès la réservation. C'est assez désagréable de voir un prix mais devoir payer plus à la fin.| Les croissants étaient délicieux. La cuisine OK. les équipements au top! J'ai aimé le cadre, le personnel, particulièrement le personnel d'accueil|
