note; resume; opinions
6.0;Séjour agréable quelque petit détail manque à l’appel merci à mme aurianne de son accueil; Bonjour je n’ai pas apprécié à mon arrivé que l’appartement n’était pas prêt à me recevoir encore à l’arrivé pas d’eau chaude pas assez de serviette une serviette par couple bouteille de gaz vide et  gouvernante pas du tout à sa place pas de contrôle de l’appartement avant notre arrivé et pas assez d’ustensiles à la cuisine pas de chiffon pas de passoire pour les pâtes et surtout le pire les  toilette bouger  assez fréquemment| Bonjour on a aimer l’espace de l’appartement le confort de la literie la propreté en général et la gentillesse  Du personnel et une excellente personne à l’accueil surtout mme Aurianne l’appartement été très confortable|
6.0;Bien; La baignoire trop haute accès difficile pour des personnes de moins d un mètre 84| Le lit de la chambre principal|
10; Exceptionnel ; Lit confortable, climatisation et wifi parfaits|
10;Super; Ras| Super appartement !!! Celui de 80m2 est top !|
1.0;Degoutant a decommander absolument.; Accueil et gestion des reservations deplorables. Ma reservation initiale pour un studio bien que confirmee a ete attribuee a un autre client. La jeune Dame trouvee a l'arrivee m'a propose au double de mon budget, un appartement de deux chambres. Totalement absurde puisque j'etais seul. Meme le gerant appele au telephone par la receptionniste est reste ferme sur ses exigences financieres. Ma proposition d'occuper une seule chambre dans l'appartement propose au prix du studio est restee sans effet. J'ai pas eu d'autre choix que de repartir en pleine nuit chercher un autre etablissement pouvant m'heberger. C'est triste ce degre d'amour d'argent qui frise l'escroquerie, le mepris de la dignite humaine et de la securite des clients.| Rien|
4.0; Décevant ; Différent de l'annonce faite  sur internet.  60m2 vendu our a peine 35m2 offert !scandale.  Pas de bon services des chambres  | Rien|
5.0;passable; Pas de restaurant. Four et micro onde hors service| Pas de petit dejeuné disponible|
6.0; Agréable ; Le service| Les équipements sont formidables y compris le lit mais le personnel doit être formé . La qualité du service manque de professionnalisme|
8.0; Très bien ; Tout est bien| La cuisine dans les chambres est super équipée. Trop bien|
7.0;Évaluation; Que l'équipe de nettoyage me réveille pour faire le ménage. La caution, oui mais soyez souple ou dites le aux clients dans la réservation| Accueil, calme, propre, sécurisé|
10;Week-end à Résidency Loumia avec Ma Famille.; Pas  de  Mouchoirs jetables ( Essuie Tout ) à la cuisine.| Receptioniste  (Gladys ) Disponible et Professionnelle .  SECURITE. Propreté. Flexibilité. Les Chambres sont Spacieuses.|

8.0;Je reviendrai; La connexion wifi| Le cadre est propre et confortable. Le personnel est accueillant Le petit déjeuner est excellent|
7.0;Séjour agréable; La soirée barbecue très peu animée pour un vendredi soir| L'accueil chaleureux. La proximité avec l'aéroport. La navette gratuite. La proximité du personnel avec les clients.|
8.0;L’emplacement est à proximité d’une route brouillante, les Klaxons vous réveillent déjà dès 5 h du matin; Le Personnel est très accueillant et aux petits soins pour les clients. L’établissement est propre. Navette Aéroport à disposition pour les voyageurs |
7.0; Bien  ; Les prix relativement élevés| L'accueil|
7.0; Bien  ; Mauvaise cuisine. La qualité est à revoir rapidement.|
7.1; Bien  ; L’emplacement | Le confort|
7.0;Agréable hôtel, personnel accueillant; Wifi peu performant à certains niveaux de l’ime 5ème Etage aile  droite.| Bonne literie|
6.7; Agréable ; Le personnel |
8.3; Très bien ; Coffre fort défectueux en chambre 709 Bruit de la chasse d'eau en chambre 709| Personnel réactif, disponible et agréable |
7.5; Bien  ; Restaurant service tres lent|
7.1;Mon séjoiur s'est bien passé; La salle de bain est vraiment exigue| La disponibilité des agents de la réception, la propreté permanente de ma chambre|
7.5;Bref séjour; Salle de bains exiguë. Place de parking trop étroite. Pas d'ascenseur au parking en sous sol. | Le calme. Bonne literie. Le buffet petit déjeuner. |
7.5;Séjour assez bien. Nous aurions pu mettre bien s’il n’y avait pas eu ce problème de petit déjeuner.; On nous a fait payer un petit déjeuner alors que la était pour mon époux et moi et qu’il était inclus dans le tarif| Le petit déjeuner est le point fort de l’hôtel : vraiment complet et copieux|
6.7;Correct pour la région ; Pas de piscine sur site| Literie agréable et confortable. Personnel serviable et courtois. Petit-déjeuner varié et bon. Restaurant excellent qui propose également des grillades au barbecue le soir. |
8.3;Excellent; Manque de piscine à l'hôtel.| Le lit confortable|
7.5; Bien  ; J'ai pris un chauffeur qui travaille en partenariat avec l'hotel pour une excursion.  Le prix avait été fixé d'avance mais il y a eu malentendu avec le chauffeur sur la question de la devise dans lequel le prix a été fixé.  Moi je parlais très clairement en dollars, lui en milliers de CFA.  Au retour, j'ai demandé à la reception de contacter la personne de la reception qui était present.  Il a confirmé ma version des faits.  Le chauffeur a demandé à la personne responsible des relations avec la clientele - Emmanuelle Tiokeng - d'intervenir.  J'ai propose de couper la poire en deux, mais elle n'était pas prête à un compromise.  Elle estimait que la seule solution était que je paie la totalité de la somme voulue par le chauffeur.  Elle m'a dit que Alain, entre temps, avait change de version (sans doute sous pression) et m'a fait chanter, menacant des problems avec la police si je métais pied dehors.  J'ai fini par contacter le chauffeur et nous avons tout de suite trouvé un compromise acceptable pour les deux côtés. Le personnel de l'hotel, et en premier la Guest Relations Manager, devrait defendre ses clients.  Au contraire, ils se sont rués sur moi avec menace et chantage et ont systématiquement refuse de chercher un compromise (que j'ai moi-même trouvé, sans difficulté).  Je ne mettrai plus les pieds dans cet hôtel et je propose à des clients potentiels de chercher ailleurs.  Quant à Emmannuelle Tiokeng, elle devrait chercher un autre travail - un qui ne nécessite pas de contact avec des êtres humains.| L'hotel m'a bien plu, mais j'ai eu une experience désagréable que je relaterai ci-dessous.|
6.7; Agréable ; Il faut penser à revoir l'éclairage dans les chambres, les couloirs et le restaurant. Le sol de la chambre était un peu poussiéreux.| Personnel très accueillant et attentionné, un menu assez varié au restaurant de l'hôtel et des chambres bien équipées.|
5.0;Bien pour le travail; Le lit cassé des mon arrivée  , la chambre n'a pas dû être vérifié correctement. La propreté a revoir| L'emplacement|
3.3;A oublier; L'emplacement de l'hôtel (quartier dangereux), l'insalubrité de la chambre (humidité), le design, le décor, les lumières, le service réception non réactif sur une banale réclamation TV.| La gentillesse de certains membres du personnel|
5.4; Passable ; Les parties communes sombres et mal équipées. Le petit déjeuner n'est pas très varié et pris dans une salle qui n' aucune ouverture sur l'extérieur.  La terrasse est fermée par de la  tôle ondulée. Les tables y sont sales .| Les chambres sont convenables et équipées correctement, mais sombres.  Le personnel à l' accueil est accueillant. |
5.4;Cher pour ce qui offre ; Le restaurant était très mauvais et très cher. Pas très bon odeur aux couloirs et même à la chambre. Pas un vrai 4*, loin de la qualité de la falaise Yaounde et d’autres hôtels de ce prix, surtout au niveau restauration | Lit confortable. Séjour serait ok pour la moitié de prix|
5.4;je ne reviendrais pas la bas; le service n'est pas du tout à la hauteur. j'ai commandé du Room service, un sandwich au poulet plus précisément. à ma grande surprise, le sandwich était infecte, inmangeable, j'ai rappelé le room service pour me changer le sandwich et le résultat était encore pire. figurez vous qu'on m'a obligé à régler ce sandwich! je peux même vous montrer la facture.| les chambres sont correctes|
10;Je recommande; Les petits détails de finition de chantier| Le personnel est aimable|
5.8; Passable ; Encore et encore  Equipements pour2...nul😠|

8.8; Très bien ; Isolation sonore a revoir Pas d evacuation d eau dans la salle de bain, sol toujours inondé après la douche| Personnel aux petits soin très sympathique Emplacement bien situé  Très belle vue côté jardin Nourriture du restaurant très bonne |
8.3; Très bien ; Je n'y ai passé qu'une nuit donc je n'ai rien à reprocher. Un peu déçue quand même par le décor de la chambre qui n'était pas ce à quoi je m'attendais mais tout était propre.| Chambre impeccablement propre et la clim fonctionnait très bien.|
7.9; Bien  ; Télécommande climatiseur absente. |
8.0;Relaxant et inspirant !😚; Propreté respect et sécurité| Vraiment propre et sécurisé les repas aussi sont bien faits  Le seul souci c’est la lenteur du personnel dans le service sinon le reste cava propreté 90%|
10; Exceptionnel ; La route| La chambre le personnel|
5.8;Je ne suis pas sûr d'y aller à mon prochain séjour. ; - restaurant bar exigu  - plats pas bien cuisinés  - salle d'eau avec colonne de douche défaillante  - mauvais écoulement de l'eau de douche  PAS D'EAU CHAUDE. - PAS D'ESSUI PIED À LA SORTIE DE DOUCHE.  PAS DE SANDALES POUR LA DOUCHE.  PAS DE VERRE.... - PAS DE CHAÎNES CANAL+ - LE WIFI INEXISTANT. | RAS |
9.6; Fabuleux  ; Propreté,  calme, rapport qualité-prix, qualité des équipements.|
7.0; Bien  ;

8.3; Très bien ;

6.7; Agréable ;

5.4; Passable ;

7.0; Bien  ;


8.0;Tranquillité,repos et régénération d'énergie tout au long du séjour; Le fait que le câble TV avait des soucis par intermittence| Nous avons apprécié l'accueil,la facilité à communiquer avec le responsable de l'établissement et le calme et la rapidité à réagir chaque fois que besoin se faisait.|
9.0;Merveilleux, surtout que j'apprécie beaucoup la disponibilité des bibles dans l'appartement; Les moustiques quand on laisse les fenêtres ouvertes. Je suggère qu'on mette des grilles sur les fenêtres| Je ne savais pas qu'il y avait le wifi|
7.5;Bon séjour sans tracas; Accès wifi partiellement fonctionnel et pression eau des douches trop faible| Disponibilité et reactivité de notre hote|
7.5; Bien  ; La pression de l’eau n’était pas assez forte| Appartement propre |
7.5;Douala ; Manque d'ascenseur. Accès. | Le calme. La sécurité. |
8.8;Buona proposta. Consigliato. / Pas mal. Faites-y un tour; Questo commento è in italiano e in francese. Ce commentaire est en italien et francais.  IT: Il Wi-Fi purtroppo non funzionava quasi mai. La posizione non è buona per via della zona poco curata, non dipende però dal padrone di casa. FR: Le Wi-Fi fonctionnait rarement et la connexion etait plutot mauvaise. L'acces a' l'appartement est difficile, a' cause de l'etat des routes, mais evidemment, cela ne depend en rien du proprietaire de l'appartement.  Il n'y a pas d'eau chaude,  mais c'est normal au Cameroun, vu que dans la plupart des maisons, il n'y a pas d'eau chaude.  | IT: Cordialità, gentilezza, disponibilità e supporto per informazioni varie dal padrone di casa, veramente un'ottima persona. Bravo anche il custode. Appartamento spazioso e pulito.  FR: Le proprietaire de l'appartement est le plus gentil, accueillant, cordial et disponible des proprietaires que nous avons rencontres jusqu'ici. Des l'instant ou' nous avons fait notre reservation,  il nous a contactes et a toujours ete disponible pour nous donner toutes sortes de renseignements  utiles pour notre sejour. L'appartement etait tres propre.  Le soir, il y a un gardien pour assurer la securite.  J'aimerais souligner la gentillesse et la disponibilite du gardien. Il y a une machine a' laver. Ce qui est rare dans les appartements du pays. L'appartement est tres discret donc  privacy assuree.  L'appartement est spacieux et reposant.  On s'est senti chez nous pendant notre sejour. L'hopital general et le marche sont a'  500 m.  On  y reviendra surement lors de notre prochain sejour dans la ville.  |
7.9;Très bon séjour ; Nous avons été bien accueillis et aider pour monter nos valises L’appartement était beau et très propre, nous le recommandons. Il y’a des boutiques et un marché à proximité. Nous y retournerons sans hésitation |
8.0; Très bien ;

9.0; Fabuleux  ;

7.9; Bien  ;


9.0;Génial le service et une propreté impeccable; Le service|
8.0; Très bien ; Le chemin qui mène à l'hôtel est inconfortable à pieds comme en voiture. Des pavés sur cette voie jusqu'à l'hôtel ferait de cet établissement une destination presque parfaite au plan du rapport qualité-prix. | L'équipement (climatiseur , téléviseur , téléphone , table ,...) de la chambre est de bonne qualité. Le lit était confortable La salle de douche est bien équipée avec eau chaude. |
7.0; Bien  ; La sale de bain manquait de raclette et d'esuie pieds| L'emplacement, le calme et cadre reposant, et propreté |
8.0; Très bien ; - L'accès à l'hôtel n'est pas vraiment rassurant en terme de sécurité pour quelqu'un qui n'a pas de voiture. - La connexion internet était défaillante quoiqu'ils nous ont expliqué que c'était une panne survenue juste au début du long week-end. - L'hôtel n'offre le petit déjeuner qu'à une personne pourtant en faisant le booking on a bien précisé qu'on était 2.| - L'hôtel est très propre - L'hôtel a un parking sécurisé - L'hôtel est situé au cœur de Douala. Non loin de Akwa, bonapriso et bonanjo - Le personnel est accueillant et serviable - Le bâtiment est bien fait - Les chambres climatisées et propres - Les toilettes sont nickel avec des sanitaires de très bonne qualité - Eau chaude disponible en permanence|
7.0; Bien  ; Le petit déjeuner|
9.2; Fabuleux  ; Nous n'avons pas apprécié le petit sentier qui mène à l'hôtel. | Hormis le sentier, tout est super|
8.0;Très Agréable; On n'a pas servi de petits déjeuners comme convenu.| L'accueil, très paisible. Mais il faudrait mettre de cafetières dans les chambres.|
8.0; Très bien ; Le petit déjeuner peut être amélioré| Personnel très serviable. Merci à Véronique. En plein centre ville. Très bon rapport qualité prix|
6.3; Agréable ; Assez difficile.|
10;SUPERB ACCEUILL; RAS| EXCELLENT SERVICE CLIENT|
6.0;Décent hôtel; Smell No blanket  Location n access | Hôtel décent,  Neuf  Choix de meuble très basic  Bon quartier mais pas bien situé, access plutôt tumultueux  |
10;un tres beau sejour.; la route qui mene a l'hotel| Le service, l'accueil, le professionnalisme, l'écoute...|
10;Excellent, tranquille, comme je l'ai souhaité; Je souhaite très vite un grand éclairage de nuit sur la voie pour les voyageurs arrivant en milieu de nuit.| C'est veritablement la perle dans Douala. Proximité aeroport, proprété et confort irreprochable, equipe completement disponible, professionnelle et le sourire toujours de mise....Bonne cuisine. J'ai aussi aimé le calme et la localisation bien auprès de la réalité des autres habitants.|
6.0; Agréable ; Accès pas facil. Parking pas très bien entretenu.| La disponibilité et le dynamisme du personnel. La propreté de l'établissement. La sécurité |
8.0;Beau cadre. Assez caché mais paisible et tres propre. Dommage pas de vue.; Entrée non bitumée.|
6.0; Agréable ; petit dejeuner, l'hotel se trouve dans le milieu du quartier residentiel| personnel tres agreable, tout est nouveau|
7.0; Bien  ;

9.0; Fabuleux  ;

8.0; Très bien ;

8.0; Très bien ;

7.0; Bien  ;

8.0; Très bien ;

8.0; Très bien ;

7.0; Bien  ;

8.0; Très bien ; Très bien situé, demandez une chambre à l’arrière et non sur le boulevard. Belle décoration en revanche certains équipements ont fait la 2e guerre mondiale (je pense au téléphone d’une autre époque) Personnel aux petits soins!!|
8.0; Très bien ; Les moustiques au restaurant, si tu es mini à cause la chaleur,t’es mort | La chambre était propre et de matériel neuf,le personnel à l’écoute peu importe l’heure. Le petit déjeuner très varié .vraiment super |
8.0;Très agréable!; Premièrement la devanture de l’hôtel n'est pas jolie elle est vielle, il faudrait vraiment la rénover au point ou quand on nous a déposé devant on a eu peur de ce qui nous attendait à l’intérieur. alors qu'en fait l’intérieur est très jolie. aussi le service en chambre est très lent, trop lent. dommage.| j'ai adoré l’hôtel et les enfants aussi. très beau,propre. les chambres sont spacieuses et comme on était quatre ils nous ont rajouté un matelas avec son sommier confortable plus le lit bébé, le tous GRATUIT!!! tous les appareils dans la chambre et la douche fonctionnaient bien (j'avais peur du contraire) avec le nécessaire disponible pour se faire un thé ou un café dès que l'on veut. le petit déjeuner est très bien et vaut son prix et le restaurant LE TOURNEBROCHE est top (cuisine délicieuse). une très belle piscine où l'on a passé beaucoup de temps tellement on a aimé. Nous, on a trouvé notre adresse à Douala. je recommande sans hésiter|
7.0;Cet hôtel reste selon moi celui qui offre le meilleur compromis sur Douala; Certaines chambres mériteraient un rafraichissement. Climatisation trop trop bruyante, pour une efficacité relative.| L'emplacement de l'hôtel, la gentillesse et disponibilité du personnel, l'accueil, l'espace piscine (certainement le plus beau de Douala)|
8.0; Très bien ; Le quartier où il faut être très prudent de jour comme de nuit. | Le restaurant avec la piscine La disponibilité et gentillesse du personnel. Hôtel au centre de douala pratique pour les rv professionnels|
7.0; Bien  ; Le personnel très agréable et la grande piscine. |
6.3; Agréable ; Les couvertures defraichies| L accueil |
7.0;Halte confortable dans hôtel très central; Qualité du réseau internet mauvaise| Chambre bien rénovée et spacieuse Situation de l'hôtel Belle piscine Petit déjeuner bien garni|
8.0; Très bien ; La climatisation qui ne fonctionnait pas bien| Belle chambre très propre|
6.0;Agréable; Le bruit à l’extérieur.proche de la route| Cool endroit pour la famille et sécurité|
8.8; Très bien ; La chambre était super. Le personnel sympathique et à l’écoute. Grande et assez propre piscine |
8.0;Quiétude en plein centre du tumulte de Douala; ras| Parfait: accueil, personnel et propreté dignes d'un hôtel international...|
8.8;très bon séjour; Le traditionnel beignets-haricots|
7.5; Bien  ; Le matelas est trop dur pour un hôtel 4 étoiles  Le Room service reste à améliorer. La boisson ( l’eau coke ) les prix sont excessif | L’emplacement |
7.9; Bien  ; J'ai beaucoup aimé mon séjour mais sauf q c'est trop cher pour public |
7.5;une valeur sûre à Douala; il faudrait que toutes les chambres soient au même standard de rénovation| l'accueil , la tranquillité côté jardin|
7.1; Bien  ; vieillesse / modestie des installations | le personnel / la piscine |
7.9;ormis les petites tracasserie du début ! motre sejour était à la hauteur de mes attentes.; A notre arrivé à 14h chambre pas prête. Le concierge nous a demander d attendre malgré l'info capital de ma part que nous devons nous préparer pour notre mariage le lendemain matin ! pas de verre à boire pour faciliter notre attente mais le barman nous demander si on voulait commander a nos frais. nous avons demander de mettre en conciergerie nos bagages puis nous sommes partis vu que la chambre à 14h45 ETAIT TOUJOURS PAS PRÊTE. Le réceptionniste nous à mentionner le montant de notre séjour au dessus de 100€ en plus du prix réservé sur BOOKING avec précompte sur carte de 200 000 fcfa de garantie. Le lendemain j ai pris mon temps pour rencontrer la référente BOOKING qui a régulariser le BON montant à payer.  Le système de carte fonctionne très mal avec l ascenseur, j ai changer les deux cartes le deuxième jour| Accès à l'hôtel, bonne accueil pour ceux qui avaient la réponse a mes questions. le coté piscine et infrastructure périphérique avec snack et bar super !  la navette Hôtel Aéroport|
6.3;Pas mon meilleur séjour.; La qualite du reseau wi-fi, mais l'hotel ne pzut pas etre porte seul responsable....Les travaux pendant la journée, (renovation des chambres peut etre considere comme comprehensible, mais....en plus de ça... des travaux d'entretien bruyants nocturnes (3heures du matin un weekend pour désinfecter le jardin (sans avoir reçu aucune information sur le sujet au préalable )., ca ,j'ai beaucoup moins apprécié.| L'amabilité du personnel ,la réaction au problème soulevé plus bas.|
7.5; Bien  ; surtaxe à l arrivée.|
6.7; Agréable ; La connexion wi-fi catastrophique |
7.1;Heureusement que l’amabi Du personnel couvre la vétusté du bâtiment; Que des travaux se fassent toute la journée| A part l’ama Du personnel pas grand chose  Il a besoin d’un bon rafraîchissement|
9.0;Très agréable; Parking en pleine rue| Petit déjeuner copieux Emplacement plein centre ville près de plein de commodité|
4.0; Décevant ; L'hotel a un besoin urgent de Rénovation!! La douche était complètement à renovier. Trop cher pour la qualité de la chambre que nous avons eu.| Le personnel était excellent: serviable, gentil, professionnel et toujours disponible. Le petit-déjeuner était super L'enceinte à l'extérieur agréable|

8.0; Très bien ; Oppressée pour libérer la chambre On m'a fait payer le petit déjeuner| Calme et propre|
9.0;Séjour starland ; La carte de la chambre qui dérangeais à chaque fois| La propreté  l’accueil du personnel |
8.0;Très bien; -| Petit déjeuner, piscine, moderne|
7.0;Très bel endroit à recommander; Carte pas variée au restaurant.| Très bel emplacement. Chambre spacieuse. Salle de sport et piscine|
7.0;Star land ; La piscine n’est pas très grande et le wifi n’est pas très fluide en chambre | Personnel accueillant propre vraiment je recommande |
7.0; Bien  ; Check-in trop long, pas de buffet au petit déjeuner |
8.0;Acceptable; Le personnel a l’accueil et au restaurant (petit-déjeuner) n’a pas été à la hauteur.| Le calme|
8.0; Très bien ; un seul restaurant dans l'hôtel , buffet peu varié| le confort de la chambre , un quartier calme à Douala avec des restaurants à proximité|
7.1;Pourrait beaucoup mieux faie; Que l'on nous dise que l'on ne pouvait pas ajouter une nuit, alors que cela a été finalement possible après l'intervention d'une tierce personne. Comme il y a trois ans, la wifi est de piètre qualité, il faut se reconnecter sans cesse en plus. Quand on travaille, c'est usant. La télévision, elle aussi, est régulièrement coupée et il n'y a que très peu de chaînes. Pour des chambres à 135 000 FCFA, c'est très limite.| La situation de l'hôtel, le personnel aimable.|
7.5; Bien  ; Le petit dejeuner|
7.9; Bien  ; La climatisation pas assez puissante malgré le réglage à 16 degrés et la ventilation à fond.  Le bruit de la pluie sur le toit qui n'est pas isolé, je déconseille fortement le dernier étage 7eme Le petit déjeuner n'est pas digne d'un hôtel de ce standing.| La chambre propre, le lit confortable, salle de bain correct, les rideaux occultant|
7.5;satisfaite même si le prix offert par booking n était pas le même sur le terrain; la réduction suite à la promotion de noël n a pas été prise en compte par l hotel| le service était parfait. le personnel accueillant |
8.3; Très bien ; Manque 2 eme fauteuil et table basse ds la chambre. Piscine pas accueillante. Restauration à améliorer mais plein de bon restos ds le quartier.| Un des établissements récents et moderne a Douala. Chambre de bonne taille, Sdb douche bien, room service petit dej rapide sinon patience. Bar sur le toit sMpa|
3.0;Le responsable au petit-déjeuner très impoli,désagréable quand on lui pose des questions sur le buffet. Au restaurant le; Le responsable du service petit-déjeuner qui parle mal aux clients et la lenteur du service. | Les réceptionnistes et les femmes de chambre sympathiques.|
5.0;Hotel de standing, l'un des meilleurs de la ville, mais service à revoir ou à améliorer; Un personnel à l’accueil disponible mais pas souriant ni chaleureux. Durant notre séjour il y avait des travaux. Du bruit dès 7h du matin un samedi. La matelas est très bien mais les oreillers ne sont en dessous des standards de l’hôtel. Le tarif booking indiquait que le petit déjeuner était compris dans la chambre (nous avons réservé 2 chambres pour un total de 4 personnes). Mauvaise surprise lors de la facturation, le petit déjeuner est compris mais seulement pour 1 personne par chambre. Supplément de 14.000 XAF (21 EUR) pour 1 petit déjeuner parce que nous étions 3 à le prendre (je précise que sur 4 personnes, 2 avait moins de 8 ans).| La chambre est très agréable, la literie de bonne qualité. Un buffet petit déjeuner varié. Des équipements et services qui fonctionnent.|
5.4; Passable ; tout| non|
4.5; Décevant ; Côté cuisine manque d'higiene j'ai ramassé un déchet de cafard dans mon assiette.  Et  le lendemain j'ai vu un cafard marché sur le plateau de fruits au petit déjeuner.| Croissant pas chaud.|
8.0; Très bien ; Les plafonds des douches étaient rouillées. La douche était bouchée | L’accueil |
8.0;Le standing est maintenu ; RAS| Ok|
